"433","Value recent","Food","Civil range ask friend run meet where factor protect hold type might four heavy","273.65","https://picsum.photos/seed/434/200/200"
"434","Language throw available fast","Food","Interview second rather concern modern agent nice physical old business no worker amount billion image mother","83.24","https://picsum.photos/seed/435/200/200"
"435","Bed class","Outdoors","Deal high tax themselves open heart economy race customer local side necessary way scene on new write most left","204.38","https://picsum.photos/seed/436/200/200"
"436","Eye people social","Electronics","Travel friend theory in animal local blood manage use pressure once father play mind not talk drug individual leg","473.45","https://picsum.photos/seed/437/200/200"
"437","Relate course several somebody suggest","Home","Federal with notice boy sign themselves exactly same win kid couple","271.39","https://picsum.photos/seed/438/200/200"
"438","World decide","Electronics","Who watch room every film exactly side necessary chance will father art before soon choose","466.12","https://picsum.photos/seed/439/200/200"
"439","Might him indeed student finish","Outdoors","Mean political many his sister suddenly news fill wrong final though material dark","367.23","https://picsum.photos/seed/440/200/200"
"440","Animal wife maybe","Electronics","Southern capital outside piece discuss great step idea public car with particular base investment throughout discussion face color","119.51","https://picsum.photos/seed/441/200/200"
"441","Process tell tax","Home","Onto least play some eat yard too general though statement just or fine move particularly purpose low since","116.48","https://picsum.photos/seed/442/200/200"
"442","Leave professional consumer share","Home","Amount quite if bill base store cold affect woman down trouble","470.42","https://picsum.photos/seed/443/200/200"
"443","Between executive amount pass quite","Outdoors","Eat any region happy trial career chair memory without light imagine conference to","453.17","https://picsum.photos/seed/444/200/200"
"444","Democratic month nation evidence","Books","Total bring suffer help generation music indicate available approach order age image who serve establish school he","249.87","https://picsum.photos/seed/445/200/200"
"445","Else concern","Books","Conference smile lead happen instead husband station field organization during sea human cost space him grow bad either those","129.91","https://picsum.photos/seed/446/200/200"
"446","Side watch","Books","Finish simple others painting choose simply PM skin occur institution give ago three daughter","135.83","https://picsum.photos/seed/447/200/200"
"447","Up heavy structure community loss","Home","Bar owner language every peace whose nation half now likely although despite","140.52","https://picsum.photos/seed/448/200/200"
"448","Speech everything left provide","Books","Man yet scientist four west heart doctor test feel project throw day economic body road thank stand course sister","69.55","https://picsum.photos/seed/449/200/200"
"449","Phone career else stock stage","Food","Probably member nation open usually interesting discussion oil air can camera score store","425.78","https://picsum.photos/seed/450/200/200"
"450","Who general throughout suggest this","Outdoors","Thing reflect enter firm music money produce daughter center lay here matter exactly guy","215.66","https://picsum.photos/seed/451/200/200"
"451","Need season company approach","Electronics","Store present kitchen I world never make interesting course early box","423.09","https://picsum.photos/seed/452/200/200"
"452","Specific consumer guess soon","Food","Create vote against director top high man watch this","83.63","https://picsum.photos/seed/453/200/200"
"453","Your assume","Home","Way pay air bag I modern together big want free choose money party production past single sell respond when","135.68","https://picsum.photos/seed/454/200/200"
"454","Car floor development","Books","Ever first structure summer alone fact side instead top reach national weight air","488.10","https://picsum.photos/seed/455/200/200"
"455","Charge simply hold fight","Clothing","Food election feeling continue image fact card important anyone throw positive capital pay Democrat group allow","95.00","https://picsum.photos/seed/456/200/200"
"456","Site author nothing sound event","Electronics","Each report run deep same whether full but create soon president ask page unit center firm term move","407.52","https://picsum.photos/seed/457/200/200"
"457","Program five receive","Electronics","Response range identify event view director wear door finish it case","288.50","https://picsum.photos/seed/458/200/200"
"458","Anything artist","Electronics","Hold recently close often nice pick meeting major of democratic capital join true","347.84","https://picsum.photos/seed/459/200/200"
"459","Program nature nature learn billion","Food","Personal former throughout forward tree rule knowledge teacher","170.98","https://picsum.photos/seed/460/200/200"
"460","Current effort near while","Clothing","Attorney language not west within ground environmental turn than speech","174.10","https://picsum.photos/seed/461/200/200"
"461","Current hope condition","Books","Thank side whole part indeed soon discover action","195.73","https://picsum.photos/seed/462/200/200"
"462","Site bank arrive worry","Food","Old director such sing common available nothing teacher at pass indicate amount","9.18","https://picsum.photos/seed/463/200/200"
"463","Show sense cold indicate send","Outdoors","Reflect economy wait even else into chair affect behind stand rock price important all cut white oil","1.63","https://picsum.photos/seed/464/200/200"
"464","Nearly this single","Electronics","Quite player world particular yeah before young kind step its material owner establish human relationship effect","142.38","https://picsum.photos/seed/465/200/200"
"465","Discuss skin while rock","Clothing","Just degree name tend company number early great present","490.37","https://picsum.photos/seed/466/200/200"
"466","At environment","Clothing","Level drug bad industry ten team grow piece identify at do manager attention away time onto guess watch","115.63","https://picsum.photos/seed/467/200/200"
"467","Successful significant until","Outdoors","Doctor camera explain less evidence mind skin individual wall","46.24","https://picsum.photos/seed/468/200/200"
"468","Stuff remain total likely","Home","Party alone keep team skin style force trade effect course begin apply specific put international","294.30","https://picsum.photos/seed/469/200/200"
"469","Tonight prepare dinner","Electronics","Parent treat rather yard about could which big of carry especially energy under condition food","168.21","https://picsum.photos/seed/470/200/200"
"470","Place particular evidence participant","Books","Policy town relate most buy friend anyone performance up evidence mind party everyone","11.79","https://picsum.photos/seed/471/200/200"
"471","Throw sit","Outdoors","Purpose whole use right church executive pattern figure year talk compare woman your","71.44","https://picsum.photos/seed/472/200/200"
"472","Fight man pay","Books","Court product community son moment skin particularly development red nature","277.72","https://picsum.photos/seed/473/200/200"
"473","Size effort former like","Home","Charge water just seem how people another group","89.39","https://picsum.photos/seed/474/200/200"
"474","Civil example third speech","Outdoors","Least charge same behind cultural side impact green culture level song top conference writer","415.56","https://picsum.photos/seed/475/200/200"
"475","Serious cause water","Outdoors","Discover field prepare discuss full table western the few college I camera away why tonight early cold affect risk","146.09","https://picsum.photos/seed/476/200/200"
"476","Behavior safe","Books","Growth current camera final degree yet close about eye piece total","94.03","https://picsum.photos/seed/477/200/200"
"477","Door middle","Books","Reality provide must sit maintain feel million act man happy night within recent","220.33","https://picsum.photos/seed/478/200/200"
"478","Answer century send","Books","Voice degree trial follow space decide sell magazine even PM body stand none wonder until skill century","314.83","https://picsum.photos/seed/479/200/200"
"479","Central camera new","Outdoors","By dark time arm from force analysis evening remember hospital late sort seat his","467.53","https://picsum.photos/seed/480/200/200"
"480","Dark institution","Outdoors","Assume pay support base arm protect put carry expect far take hold","197.34","https://picsum.photos/seed/481/200/200"
"481","Take inside research her","Clothing","Maybe new see perform listen size resource record build","4.90","https://picsum.photos/seed/482/200/200"
"482","Same lawyer health chair","Food","Establish stage adult kind moment themselves international table make point will health travel management mean big wall","427.76","https://picsum.photos/seed/483/200/200"
"483","Travel nature drop sport","Books","Hair summer guy future join idea soon administration yeah institution often they stop beyond former","182.34","https://picsum.photos/seed/484/200/200"
"484","Own forward break close wrong","Clothing","Generation read people feeling add suffer off yourself marriage hand task bit offer conference","2.49","https://picsum.photos/seed/485/200/200"
"485","Skill far show everybody","Electronics","Choose interesting fine for mention design may understand site and degree third goal chance statement","453.57","https://picsum.photos/seed/486/200/200"
"486","Fill too","Electronics","President play hard could hope be investment heart top nearly recent chair it head","329.49","https://picsum.photos/seed/487/200/200"
"487","Maintain different commercial","Home","Show drop we she page reach central once pull term attention trade rest budget away trouble evening","136.04","https://picsum.photos/seed/488/200/200"
"488","Much job threat","Outdoors","When past someone brother civil occur window shake get democratic president usually camera onto safe whatever third never","385.61","https://picsum.photos/seed/489/200/200"
"489","Upon suddenly travel while","Electronics","Reach establish right standard daughter Mr impact company church natural security the wide senior actually director large blood","422.93","https://picsum.photos/seed/490/200/200"
"490","Place score kitchen","Books","Yourself leader fund professor population major human physical candidate stage practice consider","321.06","https://picsum.photos/seed/491/200/200"
"491","Stop market natural win","Food","Magazine part way unit test new sing size certain six however mother begin scientist government gas","1.91","https://picsum.photos/seed/492/200/200"
"492","Our section now","Clothing","Tough mission speak sell indicate effort find cultural with turn blood though rich","252.30","https://picsum.photos/seed/493/200/200"
"493","Catch which","Electronics","Safe color choice summer action agreement admit long maybe number think goal radio throughout population black represent","482.58","https://picsum.photos/seed/494/200/200"
"494","Example live though","Clothing","Good goal it capital responsibility soon organization car throughout hand wish wife growth ready these standard control number","406.62","https://picsum.photos/seed/495/200/200"
"495","Her position particularly","Electronics","Cover second way yard west career woman season woman management","391.43","https://picsum.photos/seed/496/200/200"
"496","Identify property","Food","Ok conference walk road camera it research part eight dinner do","472.69","https://picsum.photos/seed/497/200/200"
"497","Fight yard short plan","Clothing","Crime herself open become every although history its media key least performance provide woman","307.16","https://picsum.photos/seed/498/200/200"
"498","Then certainly federal","Books","Me however office phone five piece son training card want","441.38","https://picsum.photos/seed/499/200/200"
"499","Experience call treatment dream","Outdoors","Size design direction look town party worker news pick edge pass dinner discover produce leader war expect game","418.91","https://picsum.photos/seed/500/200/200"
"500","Pull upon offer write per","Electronics","Chair speech interesting skin join party experience bit from none","191.16","https://picsum.photos/seed/501/200/200"
"501","Quite seat lot behavior","Electronics","Such make mention center act too local experience voice learn hard media break method training finally garden","151.37","https://picsum.photos/seed/502/200/200"
"502","When red test","Food","Never never strong kind support few together president scientist happen worry choose market thousand low","485.05","https://picsum.photos/seed/503/200/200"
"503","Investment contain","Electronics","Truth especially event month arm education base coach control foot present money size improve note","305.79","https://picsum.photos/seed/504/200/200"
"504","Peace wait","Outdoors","Father support information board artist city worry role","468.23","https://picsum.photos/seed/505/200/200"
"505","Fill short attack would","Outdoors","Service along after beyond hour phone many manage among safe pressure life one month report season reach here","24.32","https://picsum.photos/seed/506/200/200"
"506","Foot affect","Clothing","Wonder decide environmental interesting once surface public far meeting many rich perform north shoulder because skill","385.62","https://picsum.photos/seed/507/200/200"
"507","Apply mission fear","Electronics","City fill arrive ready notice help natural clearly remain yourself consider bad","284.50","https://picsum.photos/seed/508/200/200"
"508","People wide live do","Home","Experience agency pretty measure goal push teacher attack teacher","217.49","https://picsum.photos/seed/509/200/200"
"509","Detail then sure race","Outdoors","Policy town guy them different dream wind time let notice describe","392.89","https://picsum.photos/seed/510/200/200"
"510","Game your affect","Books","Republican while development home away democratic environment your","323.79","https://picsum.photos/seed/511/200/200"
"511","Simple federal peace modern","Books","What show Democrat Republican inside continue break where may growth quite","462.55","https://picsum.photos/seed/512/200/200"
"512","Wear hospital whose past we","Home","Too community enough pick movement bar race two region away across music police news information physical","18.15","https://picsum.photos/seed/513/200/200"
"513","Address edge lead pretty","Electronics","Box evening fire phone whom public child red international school answer growth who","318.85","https://picsum.photos/seed/514/200/200"
"514","Like side record","Books","Entire oil research base produce artist yet public spend once stuff somebody need special","347.21","https://picsum.photos/seed/515/200/200"
"515","Center quite there","Electronics","Eat girl line program sense remain increase test sport reality","58.94","https://picsum.photos/seed/516/200/200"
"516","Sure class far city","Clothing","Maybe meet bit lead later let pull case should budget new blood","399.49","https://picsum.photos/seed/517/200/200"
"517","Modern move head represent","Home","Who price cup general civil southern politics perform speech no attention its nearly do hundred","120.94","https://picsum.photos/seed/518/200/200"
"518","Reflect he ago","Food","Green son hear expert decision lawyer out although behind race building four remain first","163.93","https://picsum.photos/seed/519/200/200"
"519","Happen probably address threat figure","Food","Series condition according product town something space store party surface story lot","67.10","https://picsum.photos/seed/520/200/200"
"520","Center whether","Books","Imagine when more where total stuff lead new yes question stock cause similar difficult require hit provide","499.65","https://picsum.photos/seed/521/200/200"
"521","His same pattern","Clothing","Common Democrat final keep environment front tree point yet shake will season people deal fund","445.03","https://picsum.photos/seed/522/200/200"
"522","Wind sport draw suffer","Clothing","Happen success large teach store more air big land song","271.30","https://picsum.photos/seed/523/200/200"
"523","Population conference over also charge","Books","And concern local population film similar check city glass low under party since sea order make","236.68","https://picsum.photos/seed/524/200/200"
"524","Quickly product surface","Clothing","Any church hear get century ten serious value three us game stay little three","413.33","https://picsum.photos/seed/525/200/200"
"525","Good thing mother red","Outdoors","Pass several home figure administration seem my situation interesting local really though hand size present building require start professional","84.64","https://picsum.photos/seed/526/200/200"
"526","Sit once","Outdoors","Couple walk sort official whom ago all ask analysis front free anyone president explain town during","308.91","https://picsum.photos/seed/527/200/200"
"527","Very look vote","Books","Firm indicate nation president leave particular strong low election I like us","457.59","https://picsum.photos/seed/528/200/200"
"528","Learn seven trade small","Clothing","Who Republican statement worry necessary worry huge gas finally might","18.99","https://picsum.photos/seed/529/200/200"
"529","Future skin because sometimes along","Home","Size into together goal need same appear program view around above argue black","65.25","https://picsum.photos/seed/530/200/200"
"530","Tv impact someone","Outdoors","Left perform early recently tax environmental from medical start fact visit oil yes later moment reality save","273.13","https://picsum.photos/seed/531/200/200"
"531","Word none trial focus serve","Food","List first single half similar rate to hear religious trade hotel full morning finish hand scientist science reason sing","56.57","https://picsum.photos/seed/532/200/200"
"532","Project factor study","Electronics","Family simply speak heavy service see through Republican this","95.07","https://picsum.photos/seed/533/200/200"
"533","Soldier majority treatment American","Outdoors","Any letter animal let good question either social person would rule pay TV","191.09","https://picsum.photos/seed/534/200/200"
"534","That next range level","Food","Reduce month decade walk several save as difference","315.89","https://picsum.photos/seed/535/200/200"
"535","Language notice board too","Books","Detail participant her I month professor worry gun society type minute seek make require","125.82","https://picsum.photos/seed/536/200/200"
"536","Appear green power Congress","Food","Between use think in politics allow office culture same mind leave hot that somebody","382.04","https://picsum.photos/seed/537/200/200"
"537","Cultural time president life field","Clothing","Field police put decade us fear drive low manager road apply several","483.49","https://picsum.photos/seed/538/200/200"
"538","Manage wall forget somebody","Food","Factor let west report account wide ever resource he sense treatment within PM","317.73","https://picsum.photos/seed/539/200/200"
"539","Garden minute measure","Home","Night entire skill professor expect change option before head focus fall respond dark lawyer agreement","14.43","https://picsum.photos/seed/540/200/200"
"540","Water fear","Clothing","Whole your close own range need back organization line yard","348.88","https://picsum.photos/seed/541/200/200"
"541","I good recognize condition together","Food","To stop get tell bit account across treatment use PM seat moment management research head age somebody","367.96","https://picsum.photos/seed/542/200/200"
"542","Summer own indicate","Electronics","Affect toward measure rate to movement attack edge help response choice cost notice spring money compare","406.11","https://picsum.photos/seed/543/200/200"
"543","Play mention focus expect record","Clothing","Suddenly most board break yet always me common mouth teacher care time sort form common","385.94","https://picsum.photos/seed/544/200/200"
"544","Memory over something","Books","I gun hour push onto ready myself increase teach people write people hear section former stand or","276.09","https://picsum.photos/seed/545/200/200"
"545","Moment current traditional end","Outdoors","Work foot human how save kid create decade form right account course include foot assume yeah there hotel","425.42","https://picsum.photos/seed/546/200/200"
"546","Science close enjoy value","Home","From industry west town born society small either remember young decision shoulder which deal message worker matter perform raise","216.48","https://picsum.photos/seed/547/200/200"
"547","All memory task","Electronics","Home human individual grow whether month respond factor chair hour role represent particularly director","373.06","https://picsum.photos/seed/548/200/200"
"548","Night would read","Clothing","Or fish technology under dream nation toward design","50.85","https://picsum.photos/seed/549/200/200"
"549","Bill rate rise discover","Home","Account security scene such section area worry success discuss unit owner pretty available","389.78","https://picsum.photos/seed/550/200/200"
"550","Yard identify nothing difficult member","Outdoors","Direction time those single professor rest believe final sea me out concern anything","374.35","https://picsum.photos/seed/551/200/200"
"551","Time list","Outdoors","Property spend consumer wind trial act how teach air site outside step that position stop order","28.11","https://picsum.photos/seed/552/200/200"
"552","Rather successful","Home","Available population last inside anyone successful order window apply remember measure","46.68","https://picsum.photos/seed/553/200/200"
"553","His everything bill","Outdoors","Population why individual son early simple not exist treatment president season","188.76","https://picsum.photos/seed/554/200/200"
"554","Second still peace hotel","Electronics","Deep religious catch near really on few miss prove","411.55","https://picsum.photos/seed/555/200/200"
"555","No half bit none","Electronics","Color explain strong office situation kind accept like young raise pay case","386.75","https://picsum.photos/seed/556/200/200"
"556","Type road commercial just","Clothing","Ball area southern hair ten area voice part dream woman form key hold rate role record five author anything","453.56","https://picsum.photos/seed/557/200/200"
"557","Step long start person","Food","Already everyone ever manager entire doctor whole possible direction media professor tax across personal data","124.61","https://picsum.photos/seed/558/200/200"
"558","Call unit response","Outdoors","Give those instead cut professional book firm our arrive yard these thousand artist","414.25","https://picsum.photos/seed/559/200/200"
"559","Herself page clear","Food","Reduce employee view be mention truth attorney point goal decide never mean return down feel education everybody peace","88.00","https://picsum.photos/seed/560/200/200"
"560","Party think next commercial","Clothing","Air better kid game above other start law young resource method student official forward player music music drug","386.94","https://picsum.photos/seed/561/200/200"
"561","Beyond management can listen","Outdoors","Hit now blood treatment hour produce theory suggest away relate suffer future daughter whom fear","496.84","https://picsum.photos/seed/562/200/200"
"562","Blood federal both positive","Home","Whether house human manager hold sit like or physical charge","401.17","https://picsum.photos/seed/563/200/200"
"563","Billion very customer","Food","Friend fact end social leg above sign according national","302.12","https://picsum.photos/seed/564/200/200"
"564","Call clearly","Home","Enough fast first east talk born break cost everything political assume ball","183.06","https://picsum.photos/seed/565/200/200"
"565","Administration soldier","Food","Few give yard available itself by husband size again ball unit by should health","73.83","https://picsum.photos/seed/566/200/200"
"566","Capital open food","Food","Responsibility then election write laugh area lawyer black various thank look police newspaper exist next most","148.49","https://picsum.photos/seed/567/200/200"
"567","Wife leave rest visit year","Electronics","North against personal general exist tax wife race politics develop resource security","82.03","https://picsum.photos/seed/568/200/200"
"568","Actually possible middle great artist","Outdoors","Market model change traditional since benefit near project serve difference wall past four manager","391.35","https://picsum.photos/seed/569/200/200"
"569","Now reduce get rate","Food","Result television everyone check check to eat agency despite fact find want quite scientist bit process in attorney raise","314.94","https://picsum.photos/seed/570/200/200"
"570","Entire arm Mr own responsibility","Outdoors","Approach own military perhaps top set more until service there president edge democratic minute threat","294.53","https://picsum.photos/seed/571/200/200"
"571","Increase TV room Mr","Electronics","Time brother everybody home few individual child poor offer common","444.95","https://picsum.photos/seed/572/200/200"
"572","Story actually later good","Food","Trial space near carry list rich when develop mean hold much even begin land","489.99","https://picsum.photos/seed/573/200/200"
"573","Every family store central","Home","Network one a president much wish force final model listen","82.22","https://picsum.photos/seed/574/200/200"
"574","Bit moment old simply indicate","Books","Course sea nothing economy admit close avoid majority quality manage practice religious reach","14.51","https://picsum.photos/seed/575/200/200"
