"1436","Any according worker she","Food","Large center before entire we road relate your claim suffer follow report","146.34","https://picsum.photos/seed/1437/200/200"
"1437","Serious nature animal","Books","Professor lot himself claim effect wonder free trial green soldier economic condition leader light","406.08","https://picsum.photos/seed/1438/200/200"
"1438","Special participant realize","Home","Any security age technology imagine name address bad respond television goal choice person task","280.32","https://picsum.photos/seed/1439/200/200"
"1439","Already article return","Electronics","Little play serve husband candidate level everything about must into fight seek though center executive","237.38","https://picsum.photos/seed/1440/200/200"
"1440","Occur international industry hope","Home","After writer specific generation laugh together fund church themselves expect military","346.32","https://picsum.photos/seed/1441/200/200"
"1441","Act plant actually catch top","Home","So final course foot bank message soon ask house","158.65","https://picsum.photos/seed/1442/200/200"
"1442","Catch together time","Food","Challenge understand community at detail road sometimes traditional training development message who understand cause side amount house candidate defense","447.66","https://picsum.photos/seed/1443/200/200"
"1443","Sea serious himself","Home","Describe inside process near late stage chance admit me really marriage spend must each night stage cell with","468.33","https://picsum.photos/seed/1444/200/200"
"1444","Wonder huge though contain","Outdoors","Whether contain capital back seem home hour occur TV","207.41","https://picsum.photos/seed/1445/200/200"
"1445","Really picture place social turn","Food","End half relate choose guy effect go day large anyone step again race activity rise may break much","400.14","https://picsum.photos/seed/1446/200/200"
"1446","Ahead blood art billion","Clothing","Spend then federal success air police interesting fire","268.75","https://picsum.photos/seed/1447/200/200"
"1447","Will option three training","Food","Board degree plan fact news man gas as town support tell class up young instead Mr authority","140.60","https://picsum.photos/seed/1448/200/200"
"1448","Cell important discuss parent","Outdoors","Hand group exist rate indeed big wrong green identify direction forget impact something station money certain relate","359.53","https://picsum.photos/seed/1449/200/200"
"1449","From toward moment explain worker","Food","Movement stuff care down page study smile model ready right","190.73","https://picsum.photos/seed/1450/200/200"
"1450","Pressure center rest property","Electronics","Newspaper assume daughter young wonder participant door four","106.82","https://picsum.photos/seed/1451/200/200"
"1451","Piece daughter long continue wear","Electronics","Present current protect receive simply authority record mother bit own doctor blood tonight grow method away","198.17","https://picsum.photos/seed/1452/200/200"
"1452","Serious notice each","Food","Mind single loss experience every tree feel Mr material responsibility else final it study color fill","40.66","https://picsum.photos/seed/1453/200/200"
"1453","Around Mr outside house","Electronics","Kid into age institution control quality receive daughter building near prevent worry loss include","128.53","https://picsum.photos/seed/1454/200/200"
"1454","Act prove become either","Clothing","Wall language own become degree beyond kitchen simple human especially represent personal matter analysis group the apply","37.36","https://picsum.photos/seed/1455/200/200"
"1455","Mission per small guess","Books","Office dog receive produce toward federal relationship information game step not","59.58","https://picsum.photos/seed/1456/200/200"
"1456","Include end clear enough size","Home","Here decision save matter dog deep staff push popular church keep the","209.05","https://picsum.photos/seed/1457/200/200"
"1457","Enough alone identify sign","Home","Clearly test throughout check news image news why citizen think exist matter glass time score","164.69","https://picsum.photos/seed/1458/200/200"
"1458","Arm lead","Outdoors","Economic offer science want huge tax century machine hit series among month recognize bill","455.07","https://picsum.photos/seed/1459/200/200"
"1459","Population lose stock discover everybody","Food","Purpose interview second color final follow bill would understand certain key physical daughter hard same serve day like","230.96","https://picsum.photos/seed/1460/200/200"
"1460","Speak home again down before","Books","Hair building expect lead return article will line shake bed show seem bag general yard","327.77","https://picsum.photos/seed/1461/200/200"
"1461","Interview several house clearly","Clothing","Enjoy add play it ability message third simple back religious each deep tough base other","187.42","https://picsum.photos/seed/1462/200/200"
"1462","Its condition career read","Outdoors","Fear car such put mention light us between raise interesting","313.38","https://picsum.photos/seed/1463/200/200"
"1463","Show particular you song well","Food","Bit force early at figure force industry garden believe seek husband minute fact","142.47","https://picsum.photos/seed/1464/200/200"
"1464","Military year culture","Books","Base cup executive trouble compare money subject former line yeah new land space side easy","214.65","https://picsum.photos/seed/1465/200/200"
"1465","Heavy skill heavy someone","Electronics","Artist series activity parent large voice occur seven become story marriage others chance information painting newspaper executive coach","379.40","https://picsum.photos/seed/1466/200/200"
"1466","Beautiful send whether vote","Books","Ability newspaper by price practice today performance thus physical language company against","204.12","https://picsum.photos/seed/1467/200/200"
"1467","Heavy purpose letter politics notice","Home","Pull trade save little possible rather wear us whole ok","47.02","https://picsum.photos/seed/1468/200/200"
"1468","Appear think politics","Home","Would Republican build woman base entire single if everybody","413.65","https://picsum.photos/seed/1469/200/200"
"1469","Standard recognize compare analysis","Food","Many them interview thing second thing little recently allow simple agree move account I apply hard else claim","204.07","https://picsum.photos/seed/1470/200/200"
"1470","Day happy win","Outdoors","Three evidence space appear open education center nothing partner opportunity really raise watch war","216.66","https://picsum.photos/seed/1471/200/200"
"1471","Memory series foreign","Home","See year this everyone note save his lawyer member bit charge would","101.69","https://picsum.photos/seed/1472/200/200"
"1472","Quickly ago star beyond","Clothing","Value must present everybody front when between pass food respond method give economic another Congress if","377.39","https://picsum.photos/seed/1473/200/200"
"1473","Why home kid","Clothing","Pay water character option somebody cell box skin you special window meet including get likely job","44.09","https://picsum.photos/seed/1474/200/200"
"1474","Question thought fine price","Clothing","Possible relate investment mother political out resource security happy this detail land material develop authority among","360.06","https://picsum.photos/seed/1475/200/200"
"1475","Keep whatever amount speech","Clothing","View understand compare beyond thought daughter hospital security whose win across senior color situation notice","20.22","https://picsum.photos/seed/1476/200/200"
"1476","Design state place within","Books","During as perform west fill cause nice prove window receive many cultural","46.81","https://picsum.photos/seed/1477/200/200"
"1477","Evidence parent available international be","Outdoors","Hope huge simple statement group safe process artist","26.52","https://picsum.photos/seed/1478/200/200"
"1478","Out themselves","Books","Majority stop crime phone civil and bar its actually include less professional concern little population hospital able computer","409.03","https://picsum.photos/seed/1479/200/200"
"1479","Avoid home despite first leg","Books","Paper picture remain well generation two good wish behind yard owner write real practice","331.77","https://picsum.photos/seed/1480/200/200"
"1480","Late leader citizen","Electronics","This culture very I knowledge policy tonight general store seven","393.30","https://picsum.photos/seed/1481/200/200"
"1481","Relate address support eye","Books","Effort reach right nothing trip phone play place common vote away right perhaps","61.29","https://picsum.photos/seed/1482/200/200"
"1482","Walk price","Food","Computer public fast light what record well discover pretty court since phone clearly worker participant","212.80","https://picsum.photos/seed/1483/200/200"
"1483","Little others ago that indicate","Outdoors","Water relate age quickly issue produce no million","378.41","https://picsum.photos/seed/1484/200/200"
"1484","Hear when bag wish","Food","Blood everything student reality watch whose upon understand method budget stock represent his well civil she","236.04","https://picsum.photos/seed/1485/200/200"
"1485","Pick series wait Democrat one","Books","Pick family check clear simple miss education Mrs site well","454.59","https://picsum.photos/seed/1486/200/200"
"1486","Commercial here","Books","Mention else own design list home prove include game market person mention record herself wife fast feel war standard","41.22","https://picsum.photos/seed/1487/200/200"
"1487","Ever treat","Clothing","Room meet individual civil save style space mind number reach board","321.18","https://picsum.photos/seed/1488/200/200"
"1488","Choose show either","Electronics","Evidence relate fight instead charge force matter tough","158.90","https://picsum.photos/seed/1489/200/200"
"1489","Century laugh develop owner","Food","Her cut mention walk around human language race he represent so model way","328.48","https://picsum.photos/seed/1490/200/200"
"1490","Story Congress actually","Home","Truth her whom close compare establish senior end degree discussion point","485.42","https://picsum.photos/seed/1491/200/200"
"1491","Senior opportunity city good","Home","Wear tough instead small through dog tax recent field instead worry toward","52.52","https://picsum.photos/seed/1492/200/200"
"1492","News yes player bit","Outdoors","Almost find across officer dream probably four hold soon necessary general lawyer well whether notice nice food","201.31","https://picsum.photos/seed/1493/200/200"
"1493","Decade mention unit","Outdoors","Rest front fly nature often something purpose meet budget industry daughter Mr decide sea sea three","25.17","https://picsum.photos/seed/1494/200/200"
"1494","Mouth next serious myself city","Electronics","Kind join paper color suggest affect guess thank both market join season grow college western laugh","174.83","https://picsum.photos/seed/1495/200/200"
"1495","My writer would","Outdoors","Perform thus way indeed law role song animal","209.03","https://picsum.photos/seed/1496/200/200"
"1496","Yard career beautiful history","Clothing","Natural system let growth difference view crime to boy child moment","257.60","https://picsum.photos/seed/1497/200/200"
"1497","Grow throughout soldier peace","Clothing","Opportunity a return church rise deal cultural into activity use citizen accept","250.39","https://picsum.photos/seed/1498/200/200"
"1498","Right full true","Books","Company however war once even store establish series trouble program place run fight performance fish stay conference television","14.04","https://picsum.photos/seed/1499/200/200"
"1499","Center more beyond","Electronics","Rise spend middle past kitchen body paper ground heavy various yourself situation beat large card race black","206.54","https://picsum.photos/seed/1500/200/200"
"1500","Sometimes choice","Electronics","Send dinner commercial third five might film finish across write raise hope computer","341.90","https://picsum.photos/seed/1501/200/200"
"1501","Hair focus trial stuff","Clothing","Country simple maybe program remember including else message account product sing call good let open power","405.62","https://picsum.photos/seed/1502/200/200"
"1502","Respond positive question Mr attorney","Books","Require school state tough recognize summer heart possible we","0.74","https://picsum.photos/seed/1503/200/200"
"1503","Item own","Electronics","May nor daughter energy enter be for personal concern","294.18","https://picsum.photos/seed/1504/200/200"
"1504","Compare up someone history","Outdoors","Kitchen fund send professional back Democrat simple any become wall school whether deep","367.36","https://picsum.photos/seed/1505/200/200"
"1505","Next personal car give system","Electronics","Wrong data allow several enough computer may fine evening believe radio of home worker eye","420.69","https://picsum.photos/seed/1506/200/200"
"1506","Particular street message","Outdoors","Before lose attention care other any man remain Mr attack many interest never","346.48","https://picsum.photos/seed/1507/200/200"
"1507","Forget serve someone cell","Food","Make budget six small everything painting dog another situation majority air kid sometimes","280.89","https://picsum.photos/seed/1508/200/200"
"1508","Blue agency administration law","Outdoors","Strategy process behavior even grow gas certainly itself or add front Mr smile peace central run exactly soldier","116.36","https://picsum.photos/seed/1509/200/200"
"1509","Economy skill person card","Home","Pick outside church area drive dark happy grow yes hard cover environment them field loss figure lawyer assume likely","213.20","https://picsum.photos/seed/1510/200/200"
"1510","Now organization choice growth","Books","Yard window think between perform quickly whole admit","159.70","https://picsum.photos/seed/1511/200/200"
"1511","Figure else establish network","Home","Idea party care key hear yeah what mention author hard and item point","108.48","https://picsum.photos/seed/1512/200/200"
"1512","To road person","Electronics","Bit according couple thus personal movement record president military away yes character high box suddenly drive","9.95","https://picsum.photos/seed/1513/200/200"
"1513","Cover civil stock","Electronics","Animal shake southern budget control deep well something pull","25.24","https://picsum.photos/seed/1514/200/200"
"1514","Star simple often","Food","Add very consumer training practice return growth foreign be tell guess style than determine","38.15","https://picsum.photos/seed/1515/200/200"
"1515","After clear list","Food","The throw could realize writer method wait tough","189.24","https://picsum.photos/seed/1516/200/200"
"1516","Card member become","Food","His start growth system rock deal our government her career bit attorney yet","264.34","https://picsum.photos/seed/1517/200/200"
"1517","Use property for ground","Outdoors","Stop voice senior space up hit pass indeed gun stand data","471.61","https://picsum.photos/seed/1518/200/200"
"1518","Local fact manage question smile","Outdoors","Become mouth process forget final when big certain around tough","368.19","https://picsum.photos/seed/1519/200/200"
"1519","Society former same","Food","American for task cost perform offer never town instead paper action every American there board","89.68","https://picsum.photos/seed/1520/200/200"
"1520","Yet factor avoid produce","Outdoors","Win forward wish knowledge keep sure boy position mean fear line amount","440.77","https://picsum.photos/seed/1521/200/200"
"1521","Technology like pressure lose responsibility","Electronics","Director stop million behind may affect often this read foot sport past street plant charge develop spend fear","150.54","https://picsum.photos/seed/1522/200/200"
"1522","Resource laugh relationship effort","Home","Investment open line life receive long research almost score perhaps executive difficult pressure together side strong","200.22","https://picsum.photos/seed/1523/200/200"
"1523","Present evening practice","Food","Among determine firm cultural develop in writer mean control character call both green black","360.82","https://picsum.photos/seed/1524/200/200"
"1524","Window she TV","Clothing","Out book wear back pay do above security left administration","258.80","https://picsum.photos/seed/1525/200/200"
"1525","Professional modern","Food","Find teacher democratic within large still either door control agency break interview","153.18","https://picsum.photos/seed/1526/200/200"
"1526","What garden worry","Home","Help score style better budget impact we above","290.26","https://picsum.photos/seed/1527/200/200"
"1527","Other song fast start project","Outdoors","Old writer night position military remain seek foreign PM eye base give animal camera","361.58","https://picsum.photos/seed/1528/200/200"
"1528","Government among","Clothing","Only black half enter tough dream thus executive court","102.74","https://picsum.photos/seed/1529/200/200"
"1529","Western network case education","Books","Close difference him save speech design never while would best order few maybe suffer bit act","1.33","https://picsum.photos/seed/1530/200/200"
"1530","Major agree five reveal fill","Electronics","Easy but our similar practice fact education heart president quality add body catch order story popular still property hand","72.15","https://picsum.photos/seed/1531/200/200"
"1531","Film dream notice","Home","Involve air commercial tell current yard deep teach answer field hold bag pay nice budget down series consumer","375.43","https://picsum.photos/seed/1532/200/200"
"1532","Child east not","Clothing","Sea local campaign if season amount question decide hundred","152.40","https://picsum.photos/seed/1533/200/200"
"1533","Imagine strong understand building","Electronics","High trial administration read could trip century particularly whole","405.48","https://picsum.photos/seed/1534/200/200"
"1534","Sort worry alone exactly amount","Electronics","Group relationship major special partner build become top firm budget test participant social mission","317.42","https://picsum.photos/seed/1535/200/200"
"1535","Attention mind break","Home","Official floor different measure opportunity great system hot value south themselves show money item would ground individual enough","101.58","https://picsum.photos/seed/1536/200/200"
"1536","Center television usually rather","Clothing","Down new cause could together first late young","296.42","https://picsum.photos/seed/1537/200/200"
"1537","Meet base leg","Outdoors","Professional reveal wait certain listen painting dinner side free you","176.33","https://picsum.photos/seed/1538/200/200"
"1538","Social entire hard","Food","Security yard particular produce matter control rich real eight yeah ok season service food father type want drive","372.76","https://picsum.photos/seed/1539/200/200"
"1539","Hospital work","Outdoors","These general today choose board development raise civil brother impact beyond","256.10","https://picsum.photos/seed/1540/200/200"
"1540","Let who drive","Electronics","Identify grow appear weight cost baby memory door there return man behind save person prevent door thought common gas","26.27","https://picsum.photos/seed/1541/200/200"
"1541","Word activity grow score hit","Outdoors","Land adult Mrs current identify box number prepare late show man series south","157.76","https://picsum.photos/seed/1542/200/200"
"1542","Time feeling six back","Clothing","Themselves response home middle mean air law message debate interest high court","144.53","https://picsum.photos/seed/1543/200/200"
"1543","Brother air","Outdoors","Worry result through might build arrive toward year scene explain class such law listen floor parent sign","481.20","https://picsum.photos/seed/1544/200/200"
"1544","Should add newspaper","Electronics","Radio specific base authority if law other everybody step speech language bring challenge join people activity lay","393.12","https://picsum.photos/seed/1545/200/200"
"1545","Say place party trip family","Books","Finish back media safe fall well what such course","171.45","https://picsum.photos/seed/1546/200/200"
"1546","Control ready nation many","Home","Too south join marriage term growth reduce hear foreign process team effect his whom skill ok thought","172.78","https://picsum.photos/seed/1547/200/200"
"1547","Response should defense receive development","Food","Sometimes reduce past result turn stop view tree line view north after whole local smile","89.35","https://picsum.photos/seed/1548/200/200"
"1548","Cultural alone","Home","Me collection street popular suffer focus anything and size organization vote hospital summer teach","447.87","https://picsum.photos/seed/1549/200/200"
"1549","Significant guess already government","Books","View hit cell must scientist brother serve go forget play air sort color shoulder call rest meeting strong affect","417.31","https://picsum.photos/seed/1550/200/200"
"1550","Line feel follow protect","Outdoors","Part goal accept security buy yes Republican that","128.29","https://picsum.photos/seed/1551/200/200"
"1551","Again together","Clothing","Page drop sister white nation sit beyond him skill very above represent follow hope result beautiful sometimes table thus","421.68","https://picsum.photos/seed/1552/200/200"
"1552","Need mean letter","Food","Word reality method or professional country building nothing difference none up week quite","258.56","https://picsum.photos/seed/1553/200/200"
"1553","Myself gas establish hand","Electronics","Environmental tell major call market finish natural again offer lay training house","260.51","https://picsum.photos/seed/1554/200/200"
"1554","Specific together","Electronics","Participant discuss level blue international probably out beat","224.91","https://picsum.photos/seed/1555/200/200"
"1555","Whatever car","Outdoors","Case situation money culture reason thing ground reveal quickly cover entire ball account thousand evening no","285.60","https://picsum.photos/seed/1556/200/200"
"1556","Reality ahead we","Home","Reflect piece hot same five mother around good","181.10","https://picsum.photos/seed/1557/200/200"
"1557","Daughter field final election","Electronics","Degree hard here writer care music think address Congress young majority career student boy significant","364.64","https://picsum.photos/seed/1558/200/200"
"1558","Entire significant fear","Outdoors","Business figure above scientist turn apply country foot meeting without music peace quite center","159.08","https://picsum.photos/seed/1559/200/200"
"1559","Tend health she","Outdoors","Ask value tough forget low hold radio involve debate nice wait everybody prove","114.28","https://picsum.photos/seed/1560/200/200"
"1560","Us alone do move you","Food","Hard population officer wear it unit store account American second somebody successful time","389.82","https://picsum.photos/seed/1561/200/200"
"1561","Local lot music","Books","Behind tend interesting move body nor nice argue people hot plant blood parent mission their","479.30","https://picsum.photos/seed/1562/200/200"
"1562","Claim record this movie offer","Food","Tonight cost strong avoid way thus heart few agree decade tell everything figure","354.81","https://picsum.photos/seed/1563/200/200"
"1563","Minute street","Electronics","Political perform knowledge responsibility able enough feel could citizen season hair cost probably","30.40","https://picsum.photos/seed/1564/200/200"
"1564","Most away six","Outdoors","Already marriage magazine cultural cut attorney everyone task high","447.28","https://picsum.photos/seed/1565/200/200"
"1565","Source woman blood research hit","Outdoors","Day sea trip try center strategy local open garden he professional shoulder","141.46","https://picsum.photos/seed/1566/200/200"
"1566","Check floor factor pass analysis","Electronics","Order can official company little event effect write road treatment director old","485.05","https://picsum.photos/seed/1567/200/200"
"1567","Decision result no evidence program","Food","Then local so least everything so firm show state somebody wide back article case easy man pull thing","488.86","https://picsum.photos/seed/1568/200/200"
"1568","Issue kid life","Food","Seat wife last training administration last phone stock effort cup speak land state knowledge","362.58","https://picsum.photos/seed/1569/200/200"
"1569","Camera fine so toward color","Books","Treat coach memory open international offer summer ground necessary dog quickly degree for","379.06","https://picsum.photos/seed/1570/200/200"
"1570","Public staff he","Home","Soon be author paper trial owner resource picture remember","369.68","https://picsum.photos/seed/1571/200/200"
"1571","Boy condition Mr","Electronics","Movie source weight pass he life Democrat cell share leader staff collection court thing himself","161.46","https://picsum.photos/seed/1572/200/200"
"1572","With various work strategy relationship","Electronics","Learn participant around late glass woman sea tend discuss less another believe night surface degree add treatment yard","73.18","https://picsum.photos/seed/1573/200/200"
"1573","Gas role","Electronics","Quickly industry which direction six analysis top almost usually majority develop prepare low act Mr","239.17","https://picsum.photos/seed/1574/200/200"
"1574","Them law trouble time","Electronics","Brother during million find condition six member model sing mouth pull such effect often answer both full","245.91","https://picsum.photos/seed/1575/200/200"
"1575","Skin already design late by","Home","Although reach responsibility buy discover subject begin improve cup thing","441.42","https://picsum.photos/seed/1576/200/200"
"1576","Former no force","Clothing","Walk activity represent for natural contain nature way walk middle light picture southern heart different store","179.98","https://picsum.photos/seed/1577/200/200"
