"861","First analysis","Food","Kind partner design learn who find number because stage cover","332.79","https://picsum.photos/seed/862/200/200"
"862","Opportunity consumer ability","Home","Find half develop mention remain off partner court on","33.85","https://picsum.photos/seed/863/200/200"
"863","Across share artist onto","Clothing","Senior now develop increase war fill successful make across meet rate my","178.78","https://picsum.photos/seed/864/200/200"
"864","Bad history still among","Outdoors","Value single answer budget name natural few I order interview now hospital firm","28.37","https://picsum.photos/seed/865/200/200"
"865","Respond product care citizen","Home","Family my my see bag artist environmental ask staff serve throw team same figure everyone","301.05","https://picsum.photos/seed/866/200/200"
"866","Their stay different deal buy","Outdoors","Color human but central a career Mrs ball much always already happen mean image research appear current positive","87.67","https://picsum.photos/seed/867/200/200"
"867","Increase radio","Outdoors","Long surface growth bag end kind what herself","58.35","https://picsum.photos/seed/868/200/200"
"868","Certain kitchen","Clothing","Talk fish cut already also perhaps information they with check forward pressure look less necessary some total","451.39","https://picsum.photos/seed/869/200/200"
"869","Voice my character attention really","Food","Strategy foot water join herself involve treat result whom inside","86.80","https://picsum.photos/seed/870/200/200"
"870","Stock bank choice number","Clothing","Instead hear this soldier scientist real sort charge after","470.14","https://picsum.photos/seed/871/200/200"
"871","Indicate teacher","Outdoors","More key walk require necessary audience throughout become call mouth coach walk","482.87","https://picsum.photos/seed/872/200/200"
"872","Born total white","Clothing","Month land degree yourself ground trouble modern east need food","32.15","https://picsum.photos/seed/873/200/200"
"873","Truth defense several company nation","Electronics","Area nation size your tree blue star despite pay especially finally them community arm than","315.86","https://picsum.photos/seed/874/200/200"
"874","Treatment point performance","Books","Avoid reason upon land fire bit life him reduce loss baby style public possible he","445.52","https://picsum.photos/seed/875/200/200"
"875","Particular check any tough","Food","Natural pass sit test choice board relate recent house bring car energy question job","93.70","https://picsum.photos/seed/876/200/200"
"876","Reduce every second","Books","Himself investment road and report walk boy building building then scene couple bar miss clear not art practice personal","101.58","https://picsum.photos/seed/877/200/200"
"877","Election data","Electronics","Five apply exactly kid discuss my anything charge story hold live soldier miss close","233.75","https://picsum.photos/seed/878/200/200"
"878","Rock trip","Outdoors","Piece maybe first eat federal develop real over individual position threat today fine side","115.62","https://picsum.photos/seed/879/200/200"
"879","Trade return difficult sister occur","Outdoors","Police still effect shake understand beautiful tonight program","432.53","https://picsum.photos/seed/880/200/200"
"880","Anyone spend any","Electronics","Church stop wear mean glass new what various woman","82.97","https://picsum.photos/seed/881/200/200"
"881","Then people sit themselves","Electronics","Part Democrat wind specific work job study even year firm dog century language ball","41.31","https://picsum.photos/seed/882/200/200"
"882","Social ball window name","Outdoors","Set throw church set fight two class sort movie senior person mouth conference long fire song","480.54","https://picsum.photos/seed/883/200/200"
"883","Cover indeed I he","Electronics","Expert cover much age do leg reality station box","339.22","https://picsum.photos/seed/884/200/200"
"884","Be nothing girl effect","Outdoors","Citizen investment cause me product chance church clear final writer serious television budget fact","387.39","https://picsum.photos/seed/885/200/200"
"885","Business choice increase until","Food","Least majority third account form evening follow box significant decision","459.68","https://picsum.photos/seed/886/200/200"
"886","Rate total","Books","Far sit every smile believe section foreign know three civil official student three full kid teach eat little low","361.99","https://picsum.photos/seed/887/200/200"
"887","But world realize sell act","Electronics","Old outside trouble pay around can cause own parent paper according","61.38","https://picsum.photos/seed/888/200/200"
"888","Actually size assume market","Clothing","Citizen return some send American play know white people he exactly reflect best population learn successful","73.07","https://picsum.photos/seed/889/200/200"
"889","Ground agency least","Books","Field event well purpose brother modern stock friend fear agree population affect it","11.05","https://picsum.photos/seed/890/200/200"
"890","Organization wall land season","Home","Inside section person tonight two possible card eye for another president sometimes exactly course important","383.39","https://picsum.photos/seed/891/200/200"
"891","Interest can interview likely","Books","Professor ground small home move become thousand democratic","408.98","https://picsum.photos/seed/892/200/200"
"892","Easy interesting call","Food","Home detail seem major already bar third practice soldier least safe audience together southern drug short will wind perform","345.48","https://picsum.photos/seed/893/200/200"
"893","Idea far","Food","Note PM all about old over tell reveal thus work miss book note down team","28.89","https://picsum.photos/seed/894/200/200"
"894","Hotel affect family low movie","Books","Guess physical eye really network cost by skill western somebody four huge either","123.14","https://picsum.photos/seed/895/200/200"
"895","Tell well","Books","Financial agreement research really exactly peace country both whether somebody win card","354.35","https://picsum.photos/seed/896/200/200"
"896","Full last personal admit","Home","Evidence arm score see allow low you couple view case","219.18","https://picsum.photos/seed/897/200/200"
"897","Place reality money until","Electronics","Discussion after difference them land behind program western management organization peace nature","282.72","https://picsum.photos/seed/898/200/200"
"898","It cultural ability see eat","Food","Memory stage garden its produce carry himself source only property","471.62","https://picsum.photos/seed/899/200/200"
"899","Statement group candidate nice","Outdoors","Small admit number wall into together same between million","156.51","https://picsum.photos/seed/900/200/200"
"900","Surface color","Books","Card yourself ask season investment science care environment soon store can hear report join order speak","228.79","https://picsum.photos/seed/901/200/200"
"901","Hour condition floor treatment","Home","Notice less different while girl generation property himself","330.81","https://picsum.photos/seed/902/200/200"
"902","Learn network","Electronics","Her continue order clearly different Congress our interesting reach low audience exactly southern word face woman manager","376.97","https://picsum.photos/seed/903/200/200"
"903","Population church","Clothing","Current response specific return less staff they drop former different learn trade three sound","461.65","https://picsum.photos/seed/904/200/200"
"904","Good section often how","Outdoors","War seem think enough score enough age top rather knowledge manager","112.73","https://picsum.photos/seed/905/200/200"
"905","Speech beyond while move","Electronics","Focus speech bring free always able suggest speech tax somebody","422.70","https://picsum.photos/seed/906/200/200"
"906","Law organization their","Home","Physical official against because both drug month note institution along she sea mention live catch","189.24","https://picsum.photos/seed/907/200/200"
"907","Research lose name","Outdoors","Account face not occur leader writer onto suggest your yet break child standard likely","401.38","https://picsum.photos/seed/908/200/200"
"908","Step them population available","Clothing","Which discover tree experience whether share network performance money blue by benefit beat energy","251.37","https://picsum.photos/seed/909/200/200"
"909","Attorney both federal","Books","Leader which town down pay bed beyond student law image wait great determine protect how day bad","35.76","https://picsum.photos/seed/910/200/200"
"910","Wife middle but among","Clothing","Point trip at new card size result place imagine","1.03","https://picsum.photos/seed/911/200/200"
"911","Provide group box high","Food","More product cold adult this certainly site when everything effect check personal book final either","427.16","https://picsum.photos/seed/912/200/200"
"912","Sea until low agree budget","Books","Less list type full music position matter weight reveal","80.86","https://picsum.photos/seed/913/200/200"
"913","Build act","Outdoors","Fear care be trip wonder PM boy party policy fund more every level wonder seek though over moment","116.04","https://picsum.photos/seed/914/200/200"
"914","Somebody support democratic","Electronics","Hotel number cover writer give doctor each suggest former important later debate provide lot civil that","300.60","https://picsum.photos/seed/915/200/200"
"915","Raise capital magazine","Home","Old century truth manage parent whose ground car too mission however want discover add investment","476.47","https://picsum.photos/seed/916/200/200"
"916","Rich guy decide","Outdoors","Hear face ten ball significant game author remain","155.19","https://picsum.photos/seed/917/200/200"
"917","Water term inside leg","Food","Public fund official movie under police admit student three yard war federal across vote rise","350.61","https://picsum.photos/seed/918/200/200"
"918","Build ready difficult","Books","Staff second including certainly girl may whether boy truth happy skin analysis energy itself number baby recent","153.12","https://picsum.photos/seed/919/200/200"
"919","Yes analysis site recently","Clothing","Future country do offer up those air his imagine court still improve","463.83","https://picsum.photos/seed/920/200/200"
"920","Bank group","Home","Stay commercial garden meet summer chance act improve practice success similar yard himself too sure lead","112.31","https://picsum.photos/seed/921/200/200"
"921","Effect rise shoulder feeling","Books","Today performance only read star risk exactly character special walk","290.63","https://picsum.photos/seed/922/200/200"
"922","What great rock","Food","Third top record threat especially produce note model best type daughter always again whatever","484.92","https://picsum.photos/seed/923/200/200"
"923","War behind","Books","Movie our represent blue can professor stay billion easy child draw already","279.37","https://picsum.photos/seed/924/200/200"
"924","Information sit take back","Food","American find side good number such grow medical guess according create daughter feeling why similar long drug song","126.29","https://picsum.photos/seed/925/200/200"
"925","End site woman ever","Electronics","Whom so group too face easy member compare company according order tree total","112.31","https://picsum.photos/seed/926/200/200"
"926","Speech treat sing","Books","Push star suggest difference new discuss fear know head dark firm discover official prevent","399.59","https://picsum.photos/seed/927/200/200"
"927","Despite begin","Food","Enjoy once seat side thus final eye raise list police on bill article bed before entire into artist","25.17","https://picsum.photos/seed/928/200/200"
"928","Exist officer","Clothing","Effect adult sport according personal successful gas again camera fund character","431.27","https://picsum.photos/seed/929/200/200"
"929","Wall purpose","Electronics","Into relate property baby account difficult lead then suddenly clearly interest best mother similar girl","356.11","https://picsum.photos/seed/930/200/200"
"930","Federal painting offer necessary","Outdoors","Front seem serve any century their effort subject science growth air seem but","436.74","https://picsum.photos/seed/931/200/200"
"931","Above bank guess","Outdoors","Marriage film thank investment employee small simply practice appear floor daughter summer same simply question","180.14","https://picsum.photos/seed/932/200/200"
"932","From she here question","Home","Radio system you wish toward government energy sport mouth huge develop","117.41","https://picsum.photos/seed/933/200/200"
"933","For time around prepare conference","Electronics","Other for watch writer alone anyone professional base quite air record like activity determine Congress","355.20","https://picsum.photos/seed/934/200/200"
"934","Kitchen participant expert administration","Electronics","Small tell rather thing when system the sister while PM listen social national resource black four start machine","252.11","https://picsum.photos/seed/935/200/200"
"935","Pretty hold help","Books","Between reach strong business personal heart easy least seek prove believe job radio body however meet","217.75","https://picsum.photos/seed/936/200/200"
"936","Tough care","Food","Message education hot popular actually resource we garden security another","28.15","https://picsum.photos/seed/937/200/200"
"937","Food magazine strategy thank","Clothing","Participant again how interview short treatment prepare heavy major much himself Mrs dog billion wonder rock","85.43","https://picsum.photos/seed/938/200/200"
"938","Someone task allow","Books","More training girl adult life safe positive social its draw day staff discussion nearly million the","478.91","https://picsum.photos/seed/939/200/200"
"939","Success himself","Clothing","Among PM collection moment figure picture cold anyone","230.16","https://picsum.photos/seed/940/200/200"
"940","Enter simple finally hold","Books","People past staff fire manager what great ahead rest","211.49","https://picsum.photos/seed/941/200/200"
"941","Wind citizen wait fly","Books","Six ready management appear up bring market full talk service industry realize southern material nation boy","276.25","https://picsum.photos/seed/942/200/200"
"942","Capital history hot night almost","Clothing","As truth list program understand past happen car","104.98","https://picsum.photos/seed/943/200/200"
"943","Million personal something pattern","Food","Social up though politics go Mr door various daughter me middle scientist whether interview local attention per thousand","153.67","https://picsum.photos/seed/944/200/200"
"944","Law investment rich author friend","Electronics","Their camera either pretty maintain child computer measure for line factor one movement out wonder stand also morning","345.41","https://picsum.photos/seed/945/200/200"
"945","Arm material service","Food","Staff friend material quality think model difficult organization television your she","414.07","https://picsum.photos/seed/946/200/200"
"946","Yeah cup draw article apply","Clothing","Bad suffer live throughout authority election data light court","144.51","https://picsum.photos/seed/947/200/200"
"947","Growth Congress","Electronics","Condition degree standard realize lay interest although candidate some child argue other","63.80","https://picsum.photos/seed/948/200/200"
"948","Well teach","Outdoors","Card seven claim bill system cover health myself soon","236.97","https://picsum.photos/seed/949/200/200"
"949","Maintain hold drop seem","Books","Child what common meet film according operation west begin do simply organization evening","111.75","https://picsum.photos/seed/950/200/200"
"950","Discover PM growth big create","Outdoors","Stand reason control exactly age movement break even both social station save happy","388.61","https://picsum.photos/seed/951/200/200"
"951","Bank pass parent","Clothing","Popular for father family her marriage fight make enjoy concern rest magazine","376.53","https://picsum.photos/seed/952/200/200"
"952","Report well prepare","Home","Mouth change other left build once day cost fight save bag amount build region","478.01","https://picsum.photos/seed/953/200/200"
"953","Shoulder fish hospital high","Home","Prevent various bed poor view eight attorney attention remain boy firm research catch","271.18","https://picsum.photos/seed/954/200/200"
"954","Develop human risk","Food","Successful federal summer take fine blue total type carry","313.47","https://picsum.photos/seed/955/200/200"
"955","Natural computer various threat","Books","Whether red trouble travel Democrat since mission issue middle center rather fact","400.69","https://picsum.photos/seed/956/200/200"
"956","Easy station peace goal","Electronics","Without well start bed choose move use consumer similar dark claim nearly her expect majority clear north enough","167.44","https://picsum.photos/seed/957/200/200"
"957","Law front","Electronics","Paper open media claim animal short lose answer head despite idea draw research sign task maintain how","255.41","https://picsum.photos/seed/958/200/200"
"958","Group must time million","Books","Attorney similar toward drop structure since process above performance shoulder dark grow board half future","18.54","https://picsum.photos/seed/959/200/200"
"959","Situation religious eat","Electronics","Participant among onto resource theory top worker health Democrat lay city","310.84","https://picsum.photos/seed/960/200/200"
"960","Agency tell hard","Food","Report specific member red agreement strong two lose run reality until item throw we chance billion should gas","59.90","https://picsum.photos/seed/961/200/200"
"961","Official memory now","Electronics","Yourself fast court seat blood tax chance we series girl property month lot bill perhaps production financial clear","202.79","https://picsum.photos/seed/962/200/200"
"962","Relationship garden she","Food","Out begin consumer with maintain sign think travel organization window generation sometimes others million","305.10","https://picsum.photos/seed/963/200/200"
"963","Nearly style common safe operation","Food","Buy discussion music tough pass night born evening","387.15","https://picsum.photos/seed/964/200/200"
"964","Cover number pretty kid","Food","Security represent official down because large wear every itself","491.66","https://picsum.photos/seed/965/200/200"
"965","Once many look necessary teacher","Outdoors","Sister may people staff structure decision way also game head she rock","143.82","https://picsum.photos/seed/966/200/200"
"966","Manager audience head","Books","Both edge whatever according none event house entire ahead seat sign voice least suggest","332.20","https://picsum.photos/seed/967/200/200"
"967","Send seven every nearly","Home","Show forward outside show care information dark seek turn","435.87","https://picsum.photos/seed/968/200/200"
"968","Push season military","Home","Myself under story us during high catch strong area cultural couple their need method pick unit leg","447.80","https://picsum.photos/seed/969/200/200"
"969","First pick","Food","Democrat pattern speak about American ready area specific over word force fine on while piece heart","411.16","https://picsum.photos/seed/970/200/200"
"970","Couple need world","Clothing","Out tree source focus sound charge full teacher","212.67","https://picsum.photos/seed/971/200/200"
"971","Same note position","Outdoors","Participant say lawyer wish enter night professional wrong this real","270.54","https://picsum.photos/seed/972/200/200"
"972","For involve eat learn","Outdoors","Buy scene responsibility range factor itself address safe whole pattern opportunity not none everyone study","303.47","https://picsum.photos/seed/973/200/200"
"973","Catch police never never","Home","Western share site population prepare air go might establish against","160.15","https://picsum.photos/seed/974/200/200"
"974","Finally can country","Books","Onto none phone no concern me avoid citizen over trip effect ready physical explain fine power magazine friend agree","303.66","https://picsum.photos/seed/975/200/200"
"975","Own PM anyone","Outdoors","Onto opportunity face rule realize old decide old","399.33","https://picsum.photos/seed/976/200/200"
"976","Apply book they law","Electronics","Thus animal although whose huge travel family break total make pull view whose which anything care century deep","42.99","https://picsum.photos/seed/977/200/200"
"977","Song ago miss","Books","Herself defense order occur go scientist open successful","46.41","https://picsum.photos/seed/978/200/200"
"978","Letter wife make control","Food","Agree word total plant recently quality scene week manager enjoy type apply she most arm class stand","412.47","https://picsum.photos/seed/979/200/200"
"979","Success bank eye","Outdoors","Candidate president notice local perform benefit parent him window section small opportunity church high level article","41.94","https://picsum.photos/seed/980/200/200"
"980","Goal space challenge","Food","Speech result visit paper could business hand nation bit loss rate red television response draw","154.11","https://picsum.photos/seed/981/200/200"
"981","Marriage account medical across","Clothing","Radio future over floor nice true future various debate current single","145.78","https://picsum.photos/seed/982/200/200"
"982","Ago under reflect","Outdoors","System cultural trial possible necessary rule stay argue","458.27","https://picsum.photos/seed/983/200/200"
"983","Get first single agreement","Food","Music create mind those friend everybody draw just suffer pick food technology method bring art performance artist toward","228.85","https://picsum.photos/seed/984/200/200"
"984","Simply professional","Electronics","Poor yeah research who take office heart while voice might him large","159.82","https://picsum.photos/seed/985/200/200"
"985","Spend response two five Republican","Books","Ready sister television which late list responsibility thus want daughter fine beyond each check forward maybe between building","340.70","https://picsum.photos/seed/986/200/200"
"986","Treat real training remember doctor","Clothing","Trip policy drop hope Mrs story short sing wish old past if enough home former bank determine","50.37","https://picsum.photos/seed/987/200/200"
"987","Matter within party early their","Electronics","Degree fight manager state probably commercial capital short human difference add watch daughter quite matter dark position have bill","79.96","https://picsum.photos/seed/988/200/200"
"988","Truth cover type","Electronics","Hot truth price reason year interest them together team everything run inside generation want image score relate care natural","47.30","https://picsum.photos/seed/989/200/200"
"989","Factor article","Books","Democratic tell information war out remember painting key network mother bank agent character bar fish","411.03","https://picsum.photos/seed/990/200/200"
"990","Expect course vote weight less","Home","Stay trade century into newspaper media leader list meet campaign new cover finally","66.99","https://picsum.photos/seed/991/200/200"
"991","Thank affect within","Outdoors","Stage wide piece reflect herself foreign begin forward party reality open my cultural debate develop sing","447.88","https://picsum.photos/seed/992/200/200"
"992","News relate","Clothing","Evidence wide rather president exist arrive two force seem make","245.02","https://picsum.photos/seed/993/200/200"
"993","Pick he line catch","Clothing","Republican type behind anything debate recently wall take rest Mrs season sign lose change according none","30.83","https://picsum.photos/seed/994/200/200"
"994","Parent report commercial billion","Home","General marriage first fact strong west this detail give hot","303.61","https://picsum.photos/seed/995/200/200"
"995","Event perhaps class","Books","Pass protect save where be everybody recent general fall from itself man by right grow since later dog","169.32","https://picsum.photos/seed/996/200/200"
"996","Dinner smile nice technology","Home","Quality cell lot notice quality many score building politics","92.53","https://picsum.photos/seed/997/200/200"
"997","Blood produce of know","Outdoors","Conference identify fill live challenge officer carry attack most bank citizen drop reason","424.02","https://picsum.photos/seed/998/200/200"
"998","Reflect current","Books","Everybody bar data media against executive health mean meet wind floor expert letter rock process many language","253.96","https://picsum.photos/seed/999/200/200"
"999","Evening tell population","Food","Control important defense chair production radio outside yet data much debate rest sit discussion mean range","428.62","https://picsum.photos/seed/1000/200/200"
"1000","Day leg some market","Home","What civil various consider reduce perform language though expect","340.48","https://picsum.photos/seed/1001/200/200"
"1001","Huge more many","Books","Me wait early when bring discuss from night form improve","162.37","https://picsum.photos/seed/1002/200/200"
"1002","Officer direction like team member","Electronics","Option effort grow last board reflect sing how minute either computer we bag idea growth on media minute","74.42","https://picsum.photos/seed/1003/200/200"
"1003","Black detail","Outdoors","Head worker hope until partner about necessary instead civil process word people join produce or onto","37.54","https://picsum.photos/seed/1004/200/200"
"1004","Probably east analysis I hold","Food","Measure loss share process want may recently what now executive ago everything view imagine first step enough dream","301.32","https://picsum.photos/seed/1005/200/200"
"1005","Here great","Home","Film first head early study power forget yourself morning significant safe sing","15.46","https://picsum.photos/seed/1006/200/200"
