"0","Produce if prove but strong","Books","Imagine including study deep accept old writer plan where similar Congress help cut threat rise suggest","499.05","https://picsum.photos/seed/1/200/200"
"1","Time page","Outdoors","Everybody especially our impact baby against despite money adult for","270.08","https://picsum.photos/seed/2/200/200"
"2","Director much land look","Home","Require pick just officer down single southern name nature order story argue page important toward deal follow join","302.26","https://picsum.photos/seed/3/200/200"
"3","Statement number everyone peace can","Electronics","Course would seek consider item despite we push protect huge wall house himself","153.07","https://picsum.photos/seed/4/200/200"
"4","Center official product","Books","Share meeting half wait agreement available produce majority science between myself better lose guy","333.02","https://picsum.photos/seed/5/200/200"
"5","Condition join record car fear","Books","Article level yet would magazine author history toward board the shake federal few building result interesting second","194.24","https://picsum.photos/seed/6/200/200"
"6","Writer avoid affect read","Clothing","Fire space usually detail image vote account themselves significant international order herself","284.70","https://picsum.photos/seed/7/200/200"
"7","Attack serve court realize rest","Books","Scene set although identify only hope about movie health Republican we that about executive computer fear we next","48.87","https://picsum.photos/seed/8/200/200"
"8","Language indeed bring","Books","Member color southern contain near nature culture which","487.61","https://picsum.photos/seed/9/200/200"
"9","At care share","Food","Interesting television money student near then understand however effect","172.48","https://picsum.photos/seed/10/200/200"
"10","Seat strategy","Electronics","Attack from attention including everybody human final mention one arm fill character court its property trade","353.26","https://picsum.photos/seed/11/200/200"
"11","Successful upon TV police officer","Electronics","Reason every focus close into upon action challenge protect resource good","218.03","https://picsum.photos/seed/12/200/200"
"12","Structure one","Outdoors","Garden leave world science reflect second performance study car rule her newspaper teacher section present when institution agency which","209.18","https://picsum.photos/seed/13/200/200"
"13","Story six degree","Food","Camera open always share man full especially street low black side","15.47","https://picsum.photos/seed/14/200/200"
"14","Inside official hold","Books","Reflect onto prepare those admit how fall stuff if guess owner on buy skin various set four free","48.79","https://picsum.photos/seed/15/200/200"
"15","Themselves couple language clearly","Clothing","Control something area figure claim Mr force past occur for always follow boy would lose stock support officer everybody","293.72","https://picsum.photos/seed/16/200/200"
"16","Play crime produce","Electronics","Ability picture manager product shake agree about compare guess manager never similar identify usually site while strategy say","236.23","https://picsum.photos/seed/17/200/200"
"17","Clear they left tell","Clothing","His performance watch sign than on bar occur surface keep role alone analysis health business indeed","314.13","https://picsum.photos/seed/18/200/200"
"18","By will leader","Electronics","Individual carry pick room cause water range idea buy movement represent others boy such bar always pressure","167.24","https://picsum.photos/seed/19/200/200"
"19","Firm fish","Electronics","System rate myself big capital product open station check condition maintain strategy career various ready really girl sure","173.31","https://picsum.photos/seed/20/200/200"
"20","Including position fish admit price","Home","South up charge else that suffer should rest take little beyond road east participant nice home","335.99","https://picsum.photos/seed/21/200/200"
"21","Computer effort","Home","Executive nice care scene lay himself use still successful south","372.11","https://picsum.photos/seed/22/200/200"
"22","Film marriage write in","Home","Likely eat bring fly approach fine force back offer subject particular bit economic fast fine","373.49","https://picsum.photos/seed/23/200/200"
"23","As receive difficult","Home","Age star member entire child data experience as term develop at man candidate government themselves term week possible","448.99","https://picsum.photos/seed/24/200/200"
"24","Pattern part which","Books","Write usually design whether available everyone society young break feeling level","197.90","https://picsum.photos/seed/25/200/200"
"25","Economic specific apply staff","Food","Final close campaign agreement pick position white bed TV direction job television off sure","402.42","https://picsum.photos/seed/26/200/200"
"26","List TV subject","Books","Popular scientist any turn blue college receive significant energy reduce find beat lay plan face","83.81","https://picsum.photos/seed/27/200/200"
"27","Charge recognize home create","Outdoors","Health notice bit set special ago impact environmental what sign memory name become government society at get","410.31","https://picsum.photos/seed/28/200/200"
"28","Sense painting at baby","Clothing","Already agree until thousand member in best street six price sort manager strong","89.04","https://picsum.photos/seed/29/200/200"
"29","Natural next often","Food","Control local even environmental score increase audience president night member herself partner","50.18","https://picsum.photos/seed/30/200/200"
"30","Smile kid society","Home","Daughter country cut environment edge name down of perform something production","390.87","https://picsum.photos/seed/31/200/200"
"31","Agreement former phone","Food","Word if light alone represent development perhaps successful they set red accept popular line stage democratic","398.69","https://picsum.photos/seed/32/200/200"
"32","Reduce his science good major","Outdoors","Along marriage east trial cut life fear boy role","338.85","https://picsum.photos/seed/33/200/200"
"33","Season weight former exactly trial","Electronics","Teacher member simple model off official authority when group security some after stuff her once success four into","233.43","https://picsum.photos/seed/34/200/200"
"34","Season sign bad top","Outdoors","Season course campaign power why main wall grow lawyer education seem yard","167.45","https://picsum.photos/seed/35/200/200"
"35","Grow play design","Clothing","Interview rule bag offer employee get sound themselves purpose seat water nothing successful change","444.12","https://picsum.photos/seed/36/200/200"
"36","Again dinner somebody remember","Home","Truth technology great need generation social similar attack finally price car data serious future","145.86","https://picsum.photos/seed/37/200/200"
"37","Vote claim but","Electronics","Report standard wonder senior child image among production old herself concern teacher government pattern politics research too","385.36","https://picsum.photos/seed/38/200/200"
"38","Step information set into situation","Food","Pretty admit alone option ready trouble western car break early sort can election morning","359.60","https://picsum.photos/seed/39/200/200"
"39","Environment decade difficult","Home","Power dog safe feeling out Mrs nearly way great a campaign source professor behavior","137.92","https://picsum.photos/seed/40/200/200"
"40","Majority police important add head","Home","Recently court leg many effort station by long painting send team number wife as from south","112.60","https://picsum.photos/seed/41/200/200"
"41","From run manager cell","Books","Pm really effect culture glass executive in movement may","329.52","https://picsum.photos/seed/42/200/200"
"42","Class door believe","Books","Whose although beyond important party skin single at right together coach production professor","315.28","https://picsum.photos/seed/43/200/200"
"43","Institution others home job","Electronics","Case attack break keep travel least watch whether operation","282.30","https://picsum.photos/seed/44/200/200"
"44","Little surface stand","Electronics","Three prepare direction after listen prevent point glass picture run","348.58","https://picsum.photos/seed/45/200/200"
"45","Develop amount mouth","Food","Former teach class fire perhaps join result project possible line attention take evidence any name measure among memory short","291.84","https://picsum.photos/seed/46/200/200"
"46","Still rest raise","Books","Case talk provide risk expert key many actually business community any eat also her cultural may explain move","310.69","https://picsum.photos/seed/47/200/200"
"47","Same special cell save bank","Books","Turn it draw find action with try question manager pass","29.05","https://picsum.photos/seed/48/200/200"
"48","Building animal change fund","Outdoors","With teacher establish where change brother spend ahead","5.82","https://picsum.photos/seed/49/200/200"
"49","Event state","Books","Number local central billion past deep network control sound occur thousand fall challenge whether past couple","109.90","https://picsum.photos/seed/50/200/200"
"50","Recognize she father despite","Outdoors","Card culture help official leader international when then play have whole","62.12","https://picsum.photos/seed/51/200/200"
"51","Candidate natural lead even","Home","Success former organization could girl improve decade soon pressure","307.51","https://picsum.photos/seed/52/200/200"
"52","Certainly detail cultural","Food","Art so level rule stuff police people country","115.11","https://picsum.photos/seed/53/200/200"
"53","Wait movie adult","Electronics","Travel catch huge research item life song somebody minute","347.98","https://picsum.photos/seed/54/200/200"
"54","Old plan eight ahead stock","Electronics","Laugh all art poor foreign term hear hospital effort store current nor many product","136.83","https://picsum.photos/seed/55/200/200"
"55","Teacher the particular history walk","Books","Upon wonder art station line despite late collection own","272.18","https://picsum.photos/seed/56/200/200"
"56","Role agency lose sing","Outdoors","Old trouble individual recognize summer air hundred clear tough moment soldier","29.70","https://picsum.photos/seed/57/200/200"
"57","College low","Electronics","Nearly lose physical administration culture generation argue well modern occur that last available","266.41","https://picsum.photos/seed/58/200/200"
"58","Republican price game quite","Clothing","Happy whose daughter purpose allow half indicate present possible single successful would result candidate loss there treatment feeling none","278.22","https://picsum.photos/seed/59/200/200"
"59","Remain so expert","Clothing","Ball young carry investment mean wife attack memory staff environmental shoulder decade modern force","63.85","https://picsum.photos/seed/60/200/200"
"60","Simple child campaign check factor","Books","Of part American conference travel include that real share computer politics nothing","264.37","https://picsum.photos/seed/61/200/200"
"61","Prove theory bring computer","Electronics","Sea PM us fill analysis hope safe picture film media bed","497.31","https://picsum.photos/seed/62/200/200"
"62","Thousand enjoy from","Food","Popular or benefit represent who nice vote Democrat with nature property bank soon risk my others order director","22.08","https://picsum.photos/seed/63/200/200"
"63","Ahead suffer","Books","Radio something project boy some away production development always simply shake special current each","74.95","https://picsum.photos/seed/64/200/200"
"64","Crime son yes","Outdoors","Doctor life prove movement film ground chair consider yeah","132.82","https://picsum.photos/seed/65/200/200"
"65","Name tell war","Home","Adult later manage president call former join base court network manage","238.73","https://picsum.photos/seed/66/200/200"
"66","All house agree","Food","Cut put tree choice someone prepare business our view herself option end","409.75","https://picsum.photos/seed/67/200/200"
"67","Myself itself man off series","Clothing","Remember little argue reason own rich business team audience long structure","90.81","https://picsum.photos/seed/68/200/200"
"68","Do may bad important second","Electronics","Win form great doctor common treat stay parent behavior each data","269.40","https://picsum.photos/seed/69/200/200"
"69","Public in","Clothing","Watch for others wear pay medical ball too particularly represent arm ready","167.04","https://picsum.photos/seed/70/200/200"
"70","Recent hotel population husband","Home","Republican he indeed few hand hear run available summer page discover raise and black Republican","411.18","https://picsum.photos/seed/71/200/200"
"71","Degree wonder make","Electronics","Could consumer help area piece stop benefit road north speech reason shoulder","10.23","https://picsum.photos/seed/72/200/200"
"72","Short environmental save goal","Books","Mention author risk million international he mind around kind serve like mention fight their fear","90.99","https://picsum.photos/seed/73/200/200"
"73","Seat sister","Outdoors","Fast force hour institution already it people treat mother listen yeah","376.43","https://picsum.photos/seed/74/200/200"
"74","Central stage Congress","Books","Reason first marriage nation way may recent cover","106.33","https://picsum.photos/seed/75/200/200"
"75","Table visit able","Electronics","Lose organization foreign pass culture sound media through western understand","141.13","https://picsum.photos/seed/76/200/200"
"76","Account several thank college","Outdoors","Choice mind discussion I investment goal pretty fall clear ten ask later","120.43","https://picsum.photos/seed/77/200/200"
"77","Chance community special","Home","Do professor drive team into arm relate maybe whose seem put entire PM able partner across language lay","28.47","https://picsum.photos/seed/78/200/200"
"78","South between interest program state","Clothing","No him thought describe right person win not executive road","476.04","https://picsum.photos/seed/79/200/200"
"79","Each decide source know","Home","Season enjoy than occur occur travel beyond item","106.68","https://picsum.photos/seed/80/200/200"
"80","Alone suggest accept school","Food","Paper significant approach discover picture defense admit book wonder development peace early none many house often police","366.01","https://picsum.photos/seed/81/200/200"
"81","Audience should","Electronics","Executive successful pretty knowledge human feel they against song happen Congress friend green near item serve since unit","396.44","https://picsum.photos/seed/82/200/200"
"82","Couple none community","Books","That set accept city mother last score however reach serve assume affect guess million form","217.42","https://picsum.photos/seed/83/200/200"
"83","Key positive","Books","Yard hard stock fish road young collection reduce industry interview","217.48","https://picsum.photos/seed/84/200/200"
"84","Baby foot information chair","Food","Himself idea behind street fish majority help pull think maintain camera two","136.20","https://picsum.photos/seed/85/200/200"
"85","Near discuss pressure computer him","Books","Very daughter fill product station team clearly so clear born trial generation community ball of instead","460.48","https://picsum.photos/seed/86/200/200"
"86","Might here control major hope","Clothing","Church responsibility these star boy move skill effect might people recent family","205.49","https://picsum.photos/seed/87/200/200"
"87","Seven might opportunity","Clothing","Edge arrive table similar bed option half whose model offer those door will floor employee drug type","265.39","https://picsum.photos/seed/88/200/200"
"88","Organization cost fire","Books","Position recently site bed foot opportunity mouth present life than two since any","71.52","https://picsum.photos/seed/89/200/200"
"89","Able how","Food","Visit stand mother get safe paper ready north maybe herself tend art people physical once","92.54","https://picsum.photos/seed/90/200/200"
"90","All leg west pick","Outdoors","Ok see civil forward simply less campaign sit increase challenge since within five safe produce may race","244.81","https://picsum.photos/seed/91/200/200"
"91","Center your check if","Electronics","Speak or activity agent matter mother seem medical goal tonight","277.54","https://picsum.photos/seed/92/200/200"
"92","Organization top through technology","Food","Risk value two technology get boy break present authority son","497.87","https://picsum.photos/seed/93/200/200"
"93","Soldier strong charge","Home","Explain building read painting range sit today book support size city bar","72.30","https://picsum.photos/seed/94/200/200"
"94","Sign know laugh laugh","Home","Beat entire think explain out purpose whole place","205.36","https://picsum.photos/seed/95/200/200"
"95","Organization arrive know contain","Home","Season success foreign however government trouble value energy moment travel look ready","471.43","https://picsum.photos/seed/96/200/200"
"96","Technology size","Electronics","Yes find wait design no such believe middle","210.77","https://picsum.photos/seed/97/200/200"
"97","Health learn west happy","Outdoors","Agent matter design prevent memory capital include spring house prevent check country outside create performance","432.93","https://picsum.photos/seed/98/200/200"
"98","Address service ever impact explain","Books","Century process spring health finally effort skill assume finish wish rate","108.16","https://picsum.photos/seed/99/200/200"
"99","Base establish people treatment","Outdoors","Short so defense live center friend job rather politics lay foot respond ready meeting actually","461.70","https://picsum.photos/seed/100/200/200"
"100","Couple his can already side","Clothing","Education down anyone in arm defense industry writer make can these bad sister science green","373.05","https://picsum.photos/seed/101/200/200"
"101","Continue certain drive public food","Home","Republican value effect pick mean born by easy finally contain list decision many program","413.56","https://picsum.photos/seed/102/200/200"
"102","South certain","Books","Watch exactly standard big affect consider occur common group example although study role travel lawyer medical arm beat","277.01","https://picsum.photos/seed/103/200/200"
"103","Will way ground","Clothing","Accept number brother necessary can moment remain raise those similar training","328.94","https://picsum.photos/seed/104/200/200"
"104","Make arm always","Food","West growth important serve compare dark design treatment table star between though weight age young","101.32","https://picsum.photos/seed/105/200/200"
"105","Determine on follow","Outdoors","Stage hope action share make short always how officer trouble measure","477.86","https://picsum.photos/seed/106/200/200"
"106","Health deal among place","Electronics","Former fine dinner near full church seek charge friend throughout since go","218.96","https://picsum.photos/seed/107/200/200"
"107","Significant ability always help","Electronics","Memory recently pretty PM source clear dog fast remain wrong so list someone white enjoy join goal test","23.33","https://picsum.photos/seed/108/200/200"
"108","Particular institution","Books","Glass Mr my night this none attack same base site many cold firm push student perhaps","394.77","https://picsum.photos/seed/109/200/200"
"109","Or charge trouble","Clothing","Attorney perform bag manage seem recently would own","212.16","https://picsum.photos/seed/110/200/200"
"110","Right fight people open spend","Food","President cut table boy her environmental nation important decide notice plant on particular decision plant audience owner ok stock","187.67","https://picsum.photos/seed/111/200/200"
"111","Speak agency","Food","What person put see age those rise this network on shoulder","47.78","https://picsum.photos/seed/112/200/200"
"112","Nor oil forget heart","Electronics","Pass gun choose single special now until buy seven west beyond toward plant support doctor above national experience","410.28","https://picsum.photos/seed/113/200/200"
"113","Buy college next son","Electronics","Once impact agreement according mother protect pretty notice know star teach sing against offer send","148.73","https://picsum.photos/seed/114/200/200"
"114","Life this drug itself prove","Clothing","Room recognize present pattern court bill discussion while character side drive inside nice","212.08","https://picsum.photos/seed/115/200/200"
"115","Identify close now yet","Electronics","Century cost room blue media network around animal skin event season quite affect pull thing consider region find phone","222.72","https://picsum.photos/seed/116/200/200"
"116","Eye week","Books","Political pressure him professional book forward light why page popular continue","105.58","https://picsum.photos/seed/117/200/200"
"117","Finally war particular","Outdoors","Community value store suddenly major who federal only easy","453.74","https://picsum.photos/seed/118/200/200"
"118","New Republican support young compare","Home","Rock game hair night step personal sea rest old pick charge person rock as a require","433.03","https://picsum.photos/seed/119/200/200"
"119","Do may job fact drug","Electronics","Produce again leg field activity sing hour offer report after build then hospital about","311.56","https://picsum.photos/seed/120/200/200"
"120","Medical account","Home","Bad no agree sit night do kid apply any energy her if PM skin fill detail less lot","341.26","https://picsum.photos/seed/121/200/200"
"121","Behind section artist road","Clothing","Road last some friend cold major sister red necessary","391.01","https://picsum.photos/seed/122/200/200"
"122","Letter school person","Electronics","Animal task language at take side red store carry conference read its southern rest pretty deal","494.52","https://picsum.photos/seed/123/200/200"
"123","Space plant six agree","Books","Study share agree great statement truth could force subject enter challenge once","349.07","https://picsum.photos/seed/124/200/200"
"124","Anything executive there","Outdoors","Throughout on bar improve material happy return everything bill clear film often realize","4.20","https://picsum.photos/seed/125/200/200"
"125","South more interesting what","Home","Pay budget kitchen upon scene natural television field point region rise","311.77","https://picsum.photos/seed/126/200/200"
"126","Site score share push","Home","Grow number garden data wife send recognize accept purpose head medical usually east chance religious most","45.51","https://picsum.photos/seed/127/200/200"
"127","Huge this many","Books","Reflect shoulder every to worker treat station suffer book score within occur concern happen resource","306.03","https://picsum.photos/seed/128/200/200"
"128","Much authority shake also","Food","Responsibility American involve enjoy growth assume foreign Mr minute although talk begin recently","231.67","https://picsum.photos/seed/129/200/200"
"129","Way process provide","Electronics","Popular maybe read model perhaps his already doctor fact miss left including box improve factor study site","3.72","https://picsum.photos/seed/130/200/200"
"130","Summer decision into fine","Clothing","Total then action laugh doctor speech action cold most seek painting drug decide family present","241.31","https://picsum.photos/seed/131/200/200"
"131","Senior rise direction","Outdoors","Your system leader half find purpose bed few there energy hundred low south owner","216.46","https://picsum.photos/seed/132/200/200"
"132","Method position song husband end","Books","Analysis real run special suggest mission stage difficult car himself hear end significant","68.62","https://picsum.photos/seed/133/200/200"
"133","Significant age everyone","Electronics","Tonight although middle hot affect friend glass home six event time you man so officer consumer pattern","2.90","https://picsum.photos/seed/134/200/200"
"134","Alone brother herself","Books","Simple cold someone boy explain especially tell risk decade candidate officer","350.82","https://picsum.photos/seed/135/200/200"
"135","Voice enjoy story land","Clothing","Health worker ready live blood some between animal raise bring those push threat answer","292.94","https://picsum.photos/seed/136/200/200"
"136","Force modern realize line","Outdoors","Offer administration indicate answer carry size perhaps data tend name effect lot give people young probably","212.23","https://picsum.photos/seed/137/200/200"
"137","Between why result imagine artist","Home","Election important brother join positive least music technology oil adult size","155.52","https://picsum.photos/seed/138/200/200"
"138","Suddenly fine discussion hundred","Home","Response young group carry foot mission never bank rule say skin him","485.56","https://picsum.photos/seed/139/200/200"
"139","Keep choice truth pass painting","Electronics","Decision southern growth skill unit notice memory run any through development decision focus north","247.05","https://picsum.photos/seed/140/200/200"
"140","Make economy today few of","Books","Mother season behavior carry education room line because conference street take former describe need","131.48","https://picsum.photos/seed/141/200/200"
"141","Behavior rise employee reveal thus","Home","Program food center move lay dark really against city write both necessary help six alone development article","131.64","https://picsum.photos/seed/142/200/200"
"142","Affect message body perhaps","Home","Economic pay back play language have hear citizen scene choice dark tend loss term final medical truth admit","417.67","https://picsum.photos/seed/143/200/200"
"143","Family writer partner vote out","Home","Few stock play billion benefit chair age compare people meeting century lead there soon hand","391.39","https://picsum.photos/seed/144/200/200"
